{
	"type" : "object" ,
	"required" : true ,
	"$schema" : "http://json-schema.org/draft-03/schema" ,
	"properties" : {
		"alerts" : {
			"type" : "array" ,
			"required" : false ,
			"items" : 
				{
					"type" : "object" ,
					"properties" : {
						"number_of_alerts" : {
							"type" : "number" ,
							"required" : false
						} ,
						"number_of_phone_alerts" : {
							"type" : "number" ,
							"required" : false
						} ,
						"number_of_sms_alerts" : {
							"type" : "number" ,
							"required" : false
						} ,
						"number_of_email_alerts" : {
							"type" : "number" ,
							"required" : false
						} ,
						"start" : {
							"type" : "string" ,
							"required" : false
						} ,
						"end" : {
							"type" : "string" ,
							"required" : false
						}
					}
				}
			
		} ,
		"total_number_of_alerts" : {
			"type" : "number" ,
			"required" : false
		} ,
		"total_number_of_phone_alerts" : {
			"type" : "number" ,
			"required" : false
		} ,
		"total_number_of_sms_alerts" : {
			"type" : "number" ,
			"required" : false
		} ,
		"total_number_of_email_alerts" : {
			"type" : "number" ,
			"required" : false
		} ,
		"total_number_of_billable_alerts" : {
			"type" : "number" ,
			"required" : false
		}
	}
}